{
  "schema": "rbk.decision.v1",
  "decision_id": "sha256:4322a200078aa064d7b95a0f689c775d1ec7c9dd9cb71133a1b54ad344d47d84",
  "request_id": "req-04-human-required-risk",
  "policy_id": "code-patch-default",
  "policy_version": "1.0.0",
  "outcome": "human_required",
  "withheld_dimensions": ["project", "execute"],
  "factors": [
    { "factor": "applicability", "verdict": "satisfied", "reasons": [] },
    { "factor": "authority", "verdict": "satisfied", "reasons": [] },
    { "factor": "evidence", "verdict": "satisfied", "reasons": [], "evidence_ids": ["ev-04-test"] },
    { "factor": "freshness", "verdict": "satisfied", "reasons": [], "evidence_ids": ["ev-04-test"] },
    {
      "factor": "risk",
      "verdict": "human_required",
      "reasons": [
        "action.risk.impact 'critical' exceeds policy.risk.max_impact 'high'"
      ]
    },
    { "factor": "reversibility", "verdict": "satisfied", "reasons": [] }
  ],
  "identity": {
    "action_digest": "sha256:90625e78e9f8211b7e7e40963ea94a906685f3c7cff5278ebc782234c23260f4",
    "evidence_state_digest": "sha256:50ffd0d6d287bf78d8fcc4af2d2ef51199749105093a9fb3e24ba0d575d7dd57"
  },
  "routing": {
    "escalate_to": "human:eng-lead"
  },
  "computed_at": "2026-08-09T12:05:01Z",
  "kernel_version": "0.1.0"
}
