{
  "schema": "rbk.decision.v1",
  "decision_id": "sha256:510e464fa5ee00b438ceda69e4f06f295e0e4a9876c5a306d74d43c812d22018",
  "request_id": "req-03-incomplete-stale-evidence",
  "policy_id": "rag-config-change-default",
  "policy_version": "1.0.0",
  "outcome": "incomplete",
  "withheld_dimensions": ["project", "execute"],
  "factors": [
    { "factor": "applicability", "verdict": "satisfied", "reasons": [] },
    { "factor": "authority", "verdict": "satisfied", "reasons": [] },
    { "factor": "evidence", "verdict": "satisfied", "reasons": [], "evidence_ids": ["ev-03-eval-run"] },
    {
      "factor": "freshness",
      "verdict": "incomplete",
      "reasons": [
        "evidence ev-03-eval-run is stale (target_changed); policy.freshness.require_fresh=true and target_changed is not in tolerated_staleness_reasons"
      ],
      "evidence_ids": ["ev-03-eval-run"]
    },
    { "factor": "risk", "verdict": "satisfied", "reasons": [] },
    { "factor": "reversibility", "verdict": "satisfied", "reasons": [] }
  ],
  "identity": {
    "action_digest": "sha256:9bbec0d107e645444143a9d1d0c8a294dc57cd256ecffeaf82b86becf662e141",
    "evidence_state_digest": "sha256:246b152e756b1c366e1f25451a4800e896b01a185cb68fc084dbe52d2e444595"
  },
  "routing": {
    "required_evidence_modes": ["executable_test"]
  },
  "computed_at": "2026-08-09T11:00:01Z",
  "kernel_version": "0.1.0"
}
